<?xml version="1.0" encoding="UTF-8" ?>
<!--

       Copyright 2014 suning.com Holding Ltd.

       Licensed under the Apache License, Version 2.0 (the "License");
       you may not use this file except in compliance with the License.
       You may obtain a copy of the License at

          http://www.apache.org/licenses/LICENSE-2.0

       Unless required by applicable law or agreed to in writing, software
       distributed under the License is distributed on an "AS IS" BASIS,
       WITHOUT WARRANTIES OR CONDITIONS OF ANY KIND, either express or implied.
       See the License for the specific language governing permissions and
       limitations under the License.

-->
<!ELEMENT ddal-config (settings?,schema,cluster,dataNodes?,tableRules?,ruleAlgorithms?)>

<!ELEMENT settings (property*)>

<!ELEMENT schema (tableGroup* , table*)>
<!ATTLIST schema 
name CDATA #REQUIRED
metadata CDATA #IMPLIED
>


<!ELEMENT cluster (shard+)>
<!ELEMENT shard (property*)>
<!ATTLIST shard 
name CDATA #REQUIRED
>


<!ELEMENT dataNodes (datasource+)>
<!ELEMENT datasource (property*)>
<!ATTLIST datasource 
id CDATA #REQUIRED
class CDATA #IMPLIED
jndi-name CDATA #IMPLIED
>

<!ELEMENT tableRules (tableRule+)>
<!ELEMENT tableRule (#PCDATA)>
<!ATTLIST tableRule 
resource CDATA #REQUIRED
>

<!ELEMENT ruleAlgorithms (ruleAlgorithm*)>
<!ELEMENT ruleAlgorithm (property*)>
<!ATTLIST ruleAlgorithm 
name CDATA #REQUIRED
class CDATA #REQUIRED
>

<!ELEMENT table (#PCDATA)>
<!ATTLIST table
name CDATA #REQUIRED
metadata CDATA #IMPLIED
router CDATA #IMPLIED
validation (true|false) #IMPLIED
scanLevel (unlimited|filter|anyIndex|uniqueIndex|shardingKey) #IMPLIED
broadcast CDATA #IMPLIED
>

<!ELEMENT tableGroup (table+)>
<!ATTLIST tableGroup
metadata CDATA #IMPLIED
router CDATA #IMPLIED
validation (true|false) #IMPLIED
scanLevel (unlimited|filter|anyIndex|uniqueIndex|shardingKey) #IMPLIED
broadcast CDATA #IMPLIED
>

<!ELEMENT property (#PCDATA)>
<!ATTLIST property 
name CDATA #REQUIRED
value CDATA #REQUIRED
>
