<?xml version="1.0" encoding="UTF-8"?>
<!DOCTYPE ddal-config PUBLIC "-//suning.com//DTD ddal-config//EN" "http://suning.com/dtd/ddal-config.dtd">
<ddal-config>

	<schema name="PUBLIC" metadata="shard1">
		<table name="t_student" metadata="shard1.t_student_001" router="partition4_with_id_mod"/>
		<table name="t_student_course" metadata="shard1.t_student_course_001" router="partition4_with_id_mod"/>
		<table name="t_school"/>
	</schema>

	<cluster>
		<shard name="shard1">
			<property name="description" value="db1m" />
		</shard>
		<shard name="shard2">
			<property name="description" value="db2m" />
		</shard>
		<shard name="shard3">
			<property name="description" value="db3m" />
		</shard>
		<shard name="shard4">
			<property name="description" value="db4m" />
		</shard>
	</cluster>


	<dataNodes>
		<datasource id="db1m" class="org.apache.commons.dbcp.BasicDataSource">
			<property name="driverClassName" value="com.mysql.jdbc.Driver" />
			<property name="url" value="jdbc:mysql://10.19.90.76:3306/ddal_test1" />
			<property name="username" value="user" />
			<property name="password" value="abc" />
		</datasource>
		<datasource id="db1s" class="org.apache.commons.dbcp.BasicDataSource">
			<property name="driverClassName" value="com.mysql.jdbc.Driver" />
			<property name="url" value="jdbc:mysql://10.19.90.77:3306/ddal_test1" />
			<property name="username" value="user" />
			<property name="password" value="abc" />
		</datasource>
		<datasource id="db2m" class="org.apache.commons.dbcp.BasicDataSource">
			<property name="driverClassName" value="com.mysql.jdbc.Driver" />
			<property name="url" value="jdbc:mysql://10.19.90.76:3306/ddal_test2" />
			<property name="username" value="user" />
			<property name="password" value="abc" />
		</datasource>
		<datasource id="db2s" class="org.apache.commons.dbcp.BasicDataSource">
			<property name="driverClassName" value="com.mysql.jdbc.Driver" />
			<property name="url" value="jdbc:mysql://10.19.90.77:3306/ddal_test2" />
			<property name="username" value="user" />
			<property name="password" value="abc" />
		</datasource>
		<datasource id="db3m" class="org.apache.commons.dbcp.BasicDataSource">
			<property name="driverClassName" value="com.mysql.jdbc.Driver" />
			<property name="url" value="jdbc:mysql://10.19.90.76:3306/ddal_test3" />
			<property name="username" value="user" />
			<property name="password" value="abc" />
		</datasource>
		<datasource id="db3s" class="org.apache.commons.dbcp.BasicDataSource">
			<property name="driverClassName" value="com.mysql.jdbc.Driver" />
			<property name="url" value="jdbc:mysql://10.19.90.77:3306/ddal_test3" />
			<property name="username" value="user" />
			<property name="password" value="abc" />
		</datasource>
		<datasource id="db4m" class="org.apache.commons.dbcp.BasicDataSource">
			<property name="driverClassName" value="com.mysql.jdbc.Driver" />
			<property name="url" value="jdbc:mysql://10.19.90.76:3306/ddal_test4" />
			<property name="username" value="user" />
			<property name="password" value="abc" />
		</datasource>
		<datasource id="db4s" class="org.apache.commons.dbcp.BasicDataSource">
			<property name="driverClassName" value="com.mysql.jdbc.Driver" />
			<property name="url" value="jdbc:mysql://10.19.90.77:3306/ddal_test4" />
			<property name="username" value="user" />
			<property name="password" value="abc" />
		</datasource>
	</dataNodes>
	
	
	<tableRules>
		<tableRule resource="/config/ddal-rule.xml"/>
	</tableRules>

</ddal-config>